{"@context":"https://www.w3.org/ns/epub-anno.jsonld","about":{"dc:creator":["Second Reader Fixture Authors"],"dc:format":"application/epub+zip","dc:identifier":["nih:sha-256;1325ba2f76406fb22a1bb0f02edd735983cc150f64cc4af5bb00fbf6d873f7a7"],"dc:title":"Tiny Reader: Returning Light"},"generated":"2026-08-24T00:00:00Z","generator":{"id":"https://github.com/Captain4Whale/second-reader","name":"Second Reader Annotation Pack Exporter","type":"Software"},"id":"urn:uuid:94da560b-3600-5820-adb6-070fd907f32a","items":[{"created":"2026-08-24T00:01:02Z","id":"urn:uuid:4c753f7b-b63d-5cac-a850-4f357c1c56c5","motivation":"highlighting","target":{"selector":[{"exact":"durable idea","prefix":"First Return\n\nThe reader paused before the margin.\n\nA ","suffix":" is worth returning to.\n\nA quiet mark can wait without closing t","type":"TextQuoteSelector"},{"end":66,"start":54,"type":"TextPositionSelector"}],"source":"Text/first-return.xhtml"},"type":"Annotation"},{"body":{"type":"TextualBody","value":"Returning reveals the reader as part of the annotation."},"created":"2026-08-24T00:02:03Z","id":"urn:uuid:b97f3012-3f7a-5614-814f-ce94b4ef0b04","motivation":"commenting","target":{"selector":[{"exact":"reader who met them again","prefix":"d the notes without changing their words.\n\nWhat changed was the ","suffix":".\n\nThe page stayed still while attention found a different path.","type":"TextQuoteSelector"},{"end":126,"start":101,"type":"TextPositionSelector"}],"source":"Text/returning-light.xhtml"},"type":"Annotation"}],"type":"AnnotationSet"}
